{
  "id": "a7b8c9d0-e1f2-3456-0123-456789abcdef",
  "name": "Google OAuth Token",
  "credential_type": "oauth_token",
  "service": "google.com",
  "claims": {
    "access_token": "ya29.a0AfH6SMB...",
    "refresh_token": "1//0dx...",
    "token_type": "Bearer",
    "scope": "https://www.googleapis.com/auth/calendar https://www.googleapis.com/auth/contacts.readonly"
  },
  "encrypted": true,
  "expires_at": "2026-04-23T15:00:00Z",
  "source": "auth-module",
  "source_id": "auth-cred-001",
  "created_at": "2026-03-23T15:00:00Z",
  "updated_at": "2026-03-23T15:00:00Z"
}
